{"$schema":"https://json-schema.org/draft/2020-12/schema","title":"tl-mltl.command/v1","type":"object","additionalProperties":false,"properties":{"schemaVersion":{"const":"tl-mltl.command/v1"},"operation":{"enum":["evaluate","analyze","map_c2po"]},"formulaId":{"type":"string","minLength":1,"maxLength":256},"formula":{"$ref":"#/$defs/formula"},"trace":{"anyOf":[{"$ref":"#/$defs/trace"},{"type":"null"}]}},"required":["schemaVersion","operation","formulaId","formula","trace"],"$defs":{"span":{"type":"object","additionalProperties":false,"properties":{"start":{"type":"integer","minimum":0,"maximum":4294967295},"end":{"type":"integer","minimum":0,"maximum":4294967295}},"required":["start","end"]},"interval":{"type":"object","additionalProperties":false,"properties":{"start":{"type":"integer","minimum":0,"maximum":4294967295},"end":{"type":"integer","minimum":0,"maximum":4294967295}},"required":["start","end"]},"node":{"oneOf":[{"type":"object","additionalProperties":false,"properties":{"kind":{"enum":["false","true"]},"span":{"$ref":"#/$defs/span"}},"required":["kind"]},{"type":"object","additionalProperties":false,"properties":{"kind":{"const":"proposition"},"proposition":{"type":"integer","minimum":0,"maximum":4294967295},"span":{"$ref":"#/$defs/span"}},"required":["kind","proposition"]},{"type":"object","additionalProperties":false,"properties":{"kind":{"enum":["not","strong_previous"]},"operand":{"type":"integer","minimum":0,"maximum":4294967295},"span":{"$ref":"#/$defs/span"}},"required":["kind","operand"]},{"type":"object","additionalProperties":false,"properties":{"kind":{"enum":["and","or","implies","equivalent"]},"left":{"type":"integer","minimum":0,"maximum":4294967295},"right":{"type":"integer","minimum":0,"maximum":4294967295},"span":{"$ref":"#/$defs/span"}},"required":["kind","left","right"]},{"type":"object","additionalProperties":false,"properties":{"kind":{"enum":["future","globally","once","historically"]},"interval":{"$ref":"#/$defs/interval"},"operand":{"type":"integer","minimum":0,"maximum":4294967295},"span":{"$ref":"#/$defs/span"}},"required":["kind","interval","operand"]},{"type":"object","additionalProperties":false,"properties":{"kind":{"enum":["until","release","since","triggered"]},"interval":{"$ref":"#/$defs/interval"},"left":{"type":"integer","minimum":0,"maximum":4294967295},"right":{"type":"integer","minimum":0,"maximum":4294967295},"span":{"$ref":"#/$defs/span"}},"required":["kind","interval","left","right"]}]},"formula":{"type":"object","additionalProperties":false,"properties":{"schema_version":{"enum":["tl-syntax.formula/v1","tl-syntax.formula/v2"]},"semantic_profile":{"enum":["mltl.closed-trace/v1","mltl.online-prefix/v1","mltl.origin-complete-history/v1"]},"root":{"type":"integer","minimum":0,"maximum":4294967295},"nodes":{"type":"array","items":{"$ref":"#/$defs/node"},"minItems":1,"maxItems":100000}},"required":["schema_version","semantic_profile","root","nodes"]},"trace":{"type":"object","additionalProperties":false,"properties":{"schemaVersion":{"const":"tl-mltl.trace/v1"},"traceId":{"type":"string","minLength":1,"maxLength":256},"closed":{"type":"boolean"},"instants":{"type":"array","items":{"type":"array","items":{"type":"integer","minimum":0,"maximum":4294967295},"uniqueItems":true},"maxItems":1000000}},"required":["schemaVersion","traceId","closed","instants"]}}}
