{
  "schemaVersion": "tl-mltl.command/v1",
  "operation": "evaluate",
  "formulaId": "cli-evaluate-closed-v1",
  "formula": {
    "schema_version": "tl-syntax.formula/v1",
    "semantic_profile": "mltl.closed-trace/v1",
    "root": 1,
    "nodes": [
      {"kind": "proposition", "proposition": 0},
      {"kind": "globally", "interval": {"start": 0, "end": 1}, "operand": 0}
    ]
  },
  "trace": {
    "schemaVersion": "tl-mltl.trace/v1",
    "traceId": "cli-evaluate-closed-trace-v1",
    "closed": true,
    "instants": [[0], [0]]
  }
}
